Enter password: ****
Welcome to the MySQL monitor.  Commands end with ; or \g.
Your MySQL connection id is 1137
Server version: 8.0.29 MySQL Community Server - GPL

Copyright (c) 2000, 2022, Oracle and/or its affiliates.

Oracle is a registered trademark of Oracle Corporation and/or its
affiliates. Other names may be trademarks of their respective
owners.

Type 'help;' or '\h' for help. Type '\c' to clear the current input statement.

mysql> show databases;
+--------------------+
| Database           |
+--------------------+
| advance            |
| advancejava        |
| demo               |
| demo_ors           |
| information_schema |
| myproject          |
| mysql              |
| nsc                |
| ors_p10            |
| performance_schema |
| project            |
| project04          |
| project_3          |
| project_4          |
| rays               |
| result             |
| spring_boot_simple |
| sys                |
+--------------------+
18 rows in set (0.05 sec)

mysql> create database vedik;
Query OK, 1 row affected (0.05 sec)

mysql> show databases;
+--------------------+
| Database           |
+--------------------+
| advance            |
| advancejava        |
| demo               |
| demo_ors           |
| information_schema |
| myproject          |
| mysql              |
| nsc                |
| ors_p10            |
| performance_schema |
| project            |
| project04          |
| project_3          |
| project_4          |
| rays               |
| result             |
| spring_boot_simple |
| sys                |
| vedik              |
+--------------------+
19 rows in set (0.00 sec)

mysql> use vedik;
Database changed
mysql> create table employee(id int primary key, name varchar(50), salary int, company varchar(50));
Query OK, 0 rows affected (0.12 sec)

mysql> show tables;
+-----------------+
| Tables_in_vedik |
+-----------------+
| employee        |
+-----------------+
1 row in set (0.01 sec)

mysql> insert into employee values(1, 'Ram', 50000, 'TCS');
Query OK, 1 row affected (0.02 sec)

mysql> select * from employee;
+----+------+--------+---------+
| id | name | salary | company |
+----+------+--------+---------+
|  1 | Ram  |  50000 | TCS     |
+----+------+--------+---------+
1 row in set (0.02 sec)

mysql> insert into employee values(2, 'Shyam', 40000, 'NCS'),(3, 'Pawan', 35000, 'Mtech'),(4, 'Raman', 25000, 'Infosys');
Query OK, 3 rows affected (0.01 sec)
Records: 3  Duplicates: 0  Warnings: 0

mysql> select * from employee;
+----+-------+--------+---------+
| id | name  | salary | company |
+----+-------+--------+---------+
|  1 | Ram   |  50000 | TCS     |
|  2 | Shyam |  40000 | NCS     |
|  3 | Pawan |  35000 | Mtech   |
|  4 | Raman |  25000 | Infosys |
+----+-------+--------+---------+
4 rows in set (0.00 sec)

mysql> update employee set salary = 60000 where id = 4;
Query OK, 1 row affected (0.01 sec)
Rows matched: 1  Changed: 1  Warnings: 0

mysql> select * from employee;
+----+-------+--------+---------+
| id | name  | salary | company |
+----+-------+--------+---------+
|  1 | Ram   |  50000 | TCS     |
|  2 | Shyam |  40000 | NCS     |
|  3 | Pawan |  35000 | Mtech   |
|  4 | Raman |  60000 | Infosys |
+----+-------+--------+---------+
4 rows in set (0.00 sec)

mysql> delete from employee where id = 4;
Query OK, 1 row affected (0.01 sec)

mysql> select * from employee;
+----+-------+--------+---------+
| id | name  | salary | company |
+----+-------+--------+---------+
|  1 | Ram   |  50000 | TCS     |
|  2 | Shyam |  40000 | NCS     |
|  3 | Pawan |  35000 | Mtech   |
+----+-------+--------+---------+
3 rows in set (0.00 sec)

mysql>

-----------------------------------------------------------------------

mysql> select * from employee;
+----+--------+--------+---------------+
| id | name   | salary | company       |
+----+--------+--------+---------------+
|  1 | Ram    |  50000 | TCS           |
|  2 | Shyam  |  40000 | NCS           |
|  3 | Pawan  |  35000 | Mtech         |
|  4 | Amit   |  45000 | Infosys       |
|  5 | Suresh |  38000 | Wipro         |
|  6 | Priya  |  52000 | TCS           |
|  7 | Anjali |  47000 | HCL           |
|  8 | Ravi   |  43000 | Tech Mahindra |
|  9 | Kiran  |  39000 | Capgemini     |
| 10 | Meena  |  41000 | Accenture     |
| 11 | Vikram |  60000 | Infosys       |
| 12 | Pooja  |  44000 | HCL           |
| 13 | Raj    |  55000 | TCS           |
| 14 | Neha   |  47000 | Wipro         |
| 15 | Arjun  |  50000 | Tech Mahindra |
| 16 | Sunita |  48000 | Capgemini     |
| 17 | Deepak |  53000 | NCS           |
| 18 | Kavita |  46000 | Mtech         |
+----+--------+--------+---------------+
18 rows in set (0.00 sec)

mysql> select * from employee where salary > 50000;
+----+--------+--------+---------+
| id | name   | salary | company |
+----+--------+--------+---------+
|  6 | Priya  |  52000 | TCS     |
| 11 | Vikram |  60000 | Infosys |
| 13 | Raj    |  55000 | TCS     |
| 17 | Deepak |  53000 | NCS     |
+----+--------+--------+---------+
4 rows in set (0.02 sec)

mysql> select name from employee where salary > 50000;
+--------+
| name   |
+--------+
| Priya  |
| Vikram |
| Raj    |
| Deepak |
+--------+
4 rows in set (0.00 sec)

mysql> select name, company from employee where salary > 50000;
+--------+---------+
| name   | company |
+--------+---------+
| Priya  | TCS     |
| Vikram | Infosys |
| Raj    | TCS     |
| Deepak | NCS     |
+--------+---------+
4 rows in set (0.00 sec)

mysql> select name, company from employee where company =  'TCS';
+-------+---------+
| name  | company |
+-------+---------+
| Ram   | TCS     |
| Priya | TCS     |
| Raj   | TCS     |
+-------+---------+
3 rows in set (0.02 sec)

mysql> select name, company from employee where name like 'a%';
+--------+---------------+
| name   | company       |
+--------+---------------+
| Amit   | Infosys       |
| Anjali | HCL           |
| Arjun  | Tech Mahindra |
+--------+---------------+
3 rows in set (0.02 sec)

mysql> select name, company from employee where name like '%a';
+--------+-----------+
| name   | company   |
+--------+-----------+
| Priya  | TCS       |
| Meena  | Accenture |
| Pooja  | HCL       |
| Neha   | Wipro     |
| Sunita | Capgemini |
| Kavita | Mtech     |
+--------+-----------+
6 rows in set (0.00 sec)

mysql> select name, company from employee where name like '%a';
+--------+-----------+
| name   | company   |
+--------+-----------+
| Priya  | TCS       |
| Meena  | Accenture |
| Pooja  | HCL       |
| Neha   | Wipro     |
| Sunita | Capgemini |
| Kavita | Mtech     |
+--------+-----------+
6 rows in set (0.00 sec)

mysql> select coune(id) from employee;
ERROR 1305 (42000): FUNCTION vedik.coune does not exist
mysql> select count(id) from employee;
+-----------+
| count(id) |
+-----------+
|        18 |
+-----------+
1 row in set (0.03 sec)

mysql> select max(id) from employee;
+---------+
| max(id) |
+---------+
|      18 |
+---------+
1 row in set (0.03 sec)

mysql> select min(id) from employee;
+---------+
| min(id) |
+---------+
|       1 |
+---------+
1 row in set (0.03 sec)

mysql> select sum(id) from employee;
+---------+
| sum(id) |
+---------+
|     171 |
+---------+
1 row in set (0.00 sec)

mysql> select avg(id) from employee;
+---------+
| avg(id) |
+---------+
|  9.5000 |
+---------+
1 row in set (0.00 sec)

mysql> select sum(salary) from employee;
+-------------+
| sum(salary) |
+-------------+
|      833000 |
+-------------+
1 row in set (0.00 sec)

mysql> select avg(salary) from employee;
+-------------+
| avg(salary) |
+-------------+
|  46277.7778 |
+-------------+
1 row in set (0.00 sec)

mysql> select * from employee;
+----+--------+--------+---------------+
| id | name   | salary | company       |
+----+--------+--------+---------------+
|  1 | Ram    |  50000 | TCS           |
|  2 | Shyam  |  40000 | NCS           |
|  3 | Pawan  |  35000 | Mtech         |
|  4 | Amit   |  45000 | Infosys       |
|  5 | Suresh |  38000 | Wipro         |
|  6 | Priya  |  52000 | TCS           |
|  7 | Anjali |  47000 | HCL           |
|  8 | Ravi   |  43000 | Tech Mahindra |
|  9 | Kiran  |  39000 | Capgemini     |
| 10 | Meena  |  41000 | Accenture     |
| 11 | Vikram |  60000 | Infosys       |
| 12 | Pooja  |  44000 | HCL           |
| 13 | Raj    |  55000 | TCS           |
| 14 | Neha   |  47000 | Wipro         |
| 15 | Arjun  |  50000 | Tech Mahindra |
| 16 | Sunita |  48000 | Capgemini     |
| 17 | Deepak |  53000 | NCS           |
| 18 | Kavita |  46000 | Mtech         |
+----+--------+--------+---------------+
18 rows in set (0.00 sec)

mysql> select * from employee order by salary desc;
+----+--------+--------+---------------+
| id | name   | salary | company       |
+----+--------+--------+---------------+
| 11 | Vikram |  60000 | Infosys       |
| 13 | Raj    |  55000 | TCS           |
| 17 | Deepak |  53000 | NCS           |
|  6 | Priya  |  52000 | TCS           |
|  1 | Ram    |  50000 | TCS           |
| 15 | Arjun  |  50000 | Tech Mahindra |
| 16 | Sunita |  48000 | Capgemini     |
|  7 | Anjali |  47000 | HCL           |
| 14 | Neha   |  47000 | Wipro         |
| 18 | Kavita |  46000 | Mtech         |
|  4 | Amit   |  45000 | Infosys       |
| 12 | Pooja  |  44000 | HCL           |
|  8 | Ravi   |  43000 | Tech Mahindra |
| 10 | Meena  |  41000 | Accenture     |
|  2 | Shyam  |  40000 | NCS           |
|  9 | Kiran  |  39000 | Capgemini     |
|  5 | Suresh |  38000 | Wipro         |
|  3 | Pawan  |  35000 | Mtech         |
+----+--------+--------+---------------+
18 rows in set (0.00 sec)

mysql> select * from employee order by salary asc;
+----+--------+--------+---------------+
| id | name   | salary | company       |
+----+--------+--------+---------------+
|  3 | Pawan  |  35000 | Mtech         |
|  5 | Suresh |  38000 | Wipro         |
|  9 | Kiran  |  39000 | Capgemini     |
|  2 | Shyam  |  40000 | NCS           |
| 10 | Meena  |  41000 | Accenture     |
|  8 | Ravi   |  43000 | Tech Mahindra |
| 12 | Pooja  |  44000 | HCL           |
|  4 | Amit   |  45000 | Infosys       |
| 18 | Kavita |  46000 | Mtech         |
|  7 | Anjali |  47000 | HCL           |
| 14 | Neha   |  47000 | Wipro         |
| 16 | Sunita |  48000 | Capgemini     |
|  1 | Ram    |  50000 | TCS           |
| 15 | Arjun  |  50000 | Tech Mahindra |
|  6 | Priya  |  52000 | TCS           |
| 17 | Deepak |  53000 | NCS           |
| 13 | Raj    |  55000 | TCS           |
| 11 | Vikram |  60000 | Infosys       |
+----+--------+--------+---------------+
18 rows in set (0.00 sec)

mysql> select name from employee where salary = 50000;
+-------+
| name  |
+-------+
| Ram   |
| Arjun |
+-------+
2 rows in set (0.00 sec)

mysql> select * from employee where salary = 50000;
+----+-------+--------+---------------+
| id | name  | salary | company       |
+----+-------+--------+---------------+
|  1 | Ram   |  50000 | TCS           |
| 15 | Arjun |  50000 | Tech Mahindra |
+----+-------+--------+---------------+
2 rows in set (0.00 sec)

mysql>

-------------------------------------------------------

Enter password: ****
Welcome to the MySQL monitor.  Commands end with ; or \g.
Your MySQL connection id is 11
Server version: 8.0.29 MySQL Community Server - GPL

Copyright (c) 2000, 2022, Oracle and/or its affiliates.

Oracle is a registered trademark of Oracle Corporation and/or its
affiliates. Other names may be trademarks of their respective
owners.

Type 'help;' or '\h' for help. Type '\c' to clear the current input statement.

mysql> use vedik;
Database changed
mysql> select * from employee;
+----+--------+--------+---------------+
| id | name   | salary | company       |
+----+--------+--------+---------------+
|  1 | Ram    |  50000 | TCS           |
|  2 | Shyam  |  40000 | NCS           |
|  3 | Pawan  |  35000 | Mtech         |
|  4 | Amit   |  45000 | Infosys       |
|  5 | Suresh |  38000 | Wipro         |
|  6 | Priya  |  52000 | TCS           |
|  7 | Anjali |  47000 | HCL           |
|  8 | Ravi   |  43000 | Tech Mahindra |
|  9 | Kiran  |  39000 | Capgemini     |
| 10 | Meena  |  41000 | Accenture     |
| 11 | Vikram |  60000 | Infosys       |
| 12 | Pooja  |  44000 | HCL           |
| 13 | Raj    |  55000 | TCS           |
| 14 | Neha   |  47000 | Wipro         |
| 15 | Arjun  |  50000 | Tech Mahindra |
| 16 | Sunita |  48000 | Capgemini     |
| 17 | Deepak |  53000 | NCS           |
| 18 | Kavita |  46000 | Mtech         |
+----+--------+--------+---------------+
18 rows in set (0.02 sec)

mysql> select * from employee limit 0,5;
+----+--------+--------+---------+
| id | name   | salary | company |
+----+--------+--------+---------+
|  1 | Ram    |  50000 | TCS     |
|  2 | Shyam  |  40000 | NCS     |
|  3 | Pawan  |  35000 | Mtech   |
|  4 | Amit   |  45000 | Infosys |
|  5 | Suresh |  38000 | Wipro   |
+----+--------+--------+---------+
5 rows in set (0.00 sec)

mysql> select * from employee limit 1,5;
+----+--------+--------+---------+
| id | name   | salary | company |
+----+--------+--------+---------+
|  2 | Shyam  |  40000 | NCS     |
|  3 | Pawan  |  35000 | Mtech   |
|  4 | Amit   |  45000 | Infosys |
|  5 | Suresh |  38000 | Wipro   |
|  6 | Priya  |  52000 | TCS     |
+----+--------+--------+---------+
5 rows in set (0.00 sec)

mysql> select * from employee limit 3,5;
+----+--------+--------+---------------+
| id | name   | salary | company       |
+----+--------+--------+---------------+
|  4 | Amit   |  45000 | Infosys       |
|  5 | Suresh |  38000 | Wipro         |
|  6 | Priya  |  52000 | TCS           |
|  7 | Anjali |  47000 | HCL           |
|  8 | Ravi   |  43000 | Tech Mahindra |
+----+--------+--------+---------------+
5 rows in set (0.00 sec)

mysql> select * from employee limit 2,7;
+----+--------+--------+---------------+
| id | name   | salary | company       |
+----+--------+--------+---------------+
|  3 | Pawan  |  35000 | Mtech         |
|  4 | Amit   |  45000 | Infosys       |
|  5 | Suresh |  38000 | Wipro         |
|  6 | Priya  |  52000 | TCS           |
|  7 | Anjali |  47000 | HCL           |
|  8 | Ravi   |  43000 | Tech Mahindra |
|  9 | Kiran  |  39000 | Capgemini     |
+----+--------+--------+---------------+
7 rows in set (0.00 sec)

mysql> select * from employee limit 4,13;
+----+--------+--------+---------------+
| id | name   | salary | company       |
+----+--------+--------+---------------+
|  5 | Suresh |  38000 | Wipro         |
|  6 | Priya  |  52000 | TCS           |
|  7 | Anjali |  47000 | HCL           |
|  8 | Ravi   |  43000 | Tech Mahindra |
|  9 | Kiran  |  39000 | Capgemini     |
| 10 | Meena  |  41000 | Accenture     |
| 11 | Vikram |  60000 | Infosys       |
| 12 | Pooja  |  44000 | HCL           |
| 13 | Raj    |  55000 | TCS           |
| 14 | Neha   |  47000 | Wipro         |
| 15 | Arjun  |  50000 | Tech Mahindra |
| 16 | Sunita |  48000 | Capgemini     |
| 17 | Deepak |  53000 | NCS           |
+----+--------+--------+---------------+
13 rows in set (0.00 sec)

mysql> select * from employee limit 4,10;
+----+--------+--------+---------------+
| id | name   | salary | company       |
+----+--------+--------+---------------+
|  5 | Suresh |  38000 | Wipro         |
|  6 | Priya  |  52000 | TCS           |
|  7 | Anjali |  47000 | HCL           |
|  8 | Ravi   |  43000 | Tech Mahindra |
|  9 | Kiran  |  39000 | Capgemini     |
| 10 | Meena  |  41000 | Accenture     |
| 11 | Vikram |  60000 | Infosys       |
| 12 | Pooja  |  44000 | HCL           |
| 13 | Raj    |  55000 | TCS           |
| 14 | Neha   |  47000 | Wipro         |
+----+--------+--------+---------------+
10 rows in set (0.00 sec)

mysql> select * from employee limit 5,4;
+----+--------+--------+---------------+
| id | name   | salary | company       |
+----+--------+--------+---------------+
|  6 | Priya  |  52000 | TCS           |
|  7 | Anjali |  47000 | HCL           |
|  8 | Ravi   |  43000 | Tech Mahindra |
|  9 | Kiran  |  39000 | Capgemini     |
+----+--------+--------+---------------+
4 rows in set (0.00 sec)

mysql> use resu;
ERROR 1049 (42000): Unknown database 'resu'
mysql> use resut;
ERROR 1049 (42000): Unknown database 'resut'
mysql> use result;
Database changed
mysql> select * from marksheet;
+----+--------+-----------------+---------+-----------+-------+
| id | rollNo | name            | physics | chemistry | maths |
+----+--------+-----------------+---------+-----------+-------+
|  1 |    101 | Naman Meena     |      22 |       100 |   100 |
|  2 |    102 | Sachin Kalar    |      47 |        52 |    45 |
|  3 |    103 | Pawan Rajput    |      74 |        78 |    88 |
|  4 |    104 | Raj Jaat        |      57 |        32 |    23 |
|  5 |    105 | Raman Sharma    |      62 |        45 |    35 |
|  6 |    106 | Khushali Rathod |      52 |        33 |    25 |
|  7 |    107 | Anish Malwiya   |      63 |        75 |    52 |
|  8 |    108 | Uday Dabi       |      25 |        63 |    42 |
|  9 |    109 | Abhishek Yadav  |      65 |        47 |    63 |
| 10 |    110 | bhvgf           |      54 |        87 |    54 |
| 11 |    111 | Ravi Verma      |      35 |        22 |    18 |
| 12 |    112 | Manoj Sharma    |      68 |        72 |    80 |
| 13 |    113 | Aarti Gupta     |      44 |        48 |    39 |
| 14 |    114 | Vishal Patel    |      59 |        67 |    45 |
| 15 |    115 | Priya Mehta     |      82 |        88 |    91 |
| 16 |    116 | Rajni Singh     |      49 |        35 |    26 |
| 17 |    117 | Nidhi Chawla    |      60 |        55 |    53 |
| 18 |    118 | Akshay Kumar    |      73 |        78 |    81 |
| 19 |    119 | Neha Joshi      |      34 |        29 |    42 |
| 20 |    120 | Kunal Mishra    |      58 |        65 |    60 |
+----+--------+-----------------+---------+-----------+-------+
20 rows in set (0.00 sec)

mysql> select *, (pysics+chemistry+maths) as total from marksheet;
ERROR 1054 (42S22): Unknown column 'pysics' in 'field list'
mysql> select *, (physics+chemistry+maths) as total from marksheet;
+----+--------+-----------------+---------+-----------+-------+-------+
| id | rollNo | name            | physics | chemistry | maths | total |
+----+--------+-----------------+---------+-----------+-------+-------+
|  1 |    101 | Naman Meena     |      22 |       100 |   100 |   222 |
|  2 |    102 | Sachin Kalar    |      47 |        52 |    45 |   144 |
|  3 |    103 | Pawan Rajput    |      74 |        78 |    88 |   240 |
|  4 |    104 | Raj Jaat        |      57 |        32 |    23 |   112 |
|  5 |    105 | Raman Sharma    |      62 |        45 |    35 |   142 |
|  6 |    106 | Khushali Rathod |      52 |        33 |    25 |   110 |
|  7 |    107 | Anish Malwiya   |      63 |        75 |    52 |   190 |
|  8 |    108 | Uday Dabi       |      25 |        63 |    42 |   130 |
|  9 |    109 | Abhishek Yadav  |      65 |        47 |    63 |   175 |
| 10 |    110 | bhvgf           |      54 |        87 |    54 |   195 |
| 11 |    111 | Ravi Verma      |      35 |        22 |    18 |    75 |
| 12 |    112 | Manoj Sharma    |      68 |        72 |    80 |   220 |
| 13 |    113 | Aarti Gupta     |      44 |        48 |    39 |   131 |
| 14 |    114 | Vishal Patel    |      59 |        67 |    45 |   171 |
| 15 |    115 | Priya Mehta     |      82 |        88 |    91 |   261 |
| 16 |    116 | Rajni Singh     |      49 |        35 |    26 |   110 |
| 17 |    117 | Nidhi Chawla    |      60 |        55 |    53 |   168 |
| 18 |    118 | Akshay Kumar    |      73 |        78 |    81 |   232 |
| 19 |    119 | Neha Joshi      |      34 |        29 |    42 |   105 |
| 20 |    120 | Kunal Mishra    |      58 |        65 |    60 |   183 |
+----+--------+-----------------+---------+-----------+-------+-------+
20 rows in set (0.00 sec)

mysql> select *, (physics+chemistry+maths) as total, ((physics+chemistry+maths)/3) as percentage from marksheet;
+----+--------+-----------------+---------+-----------+-------+-------+------------+
| id | rollNo | name            | physics | chemistry | maths | total | percentage |
+----+--------+-----------------+---------+-----------+-------+-------+------------+
|  1 |    101 | Naman Meena     |      22 |       100 |   100 |   222 |    74.0000 |
|  2 |    102 | Sachin Kalar    |      47 |        52 |    45 |   144 |    48.0000 |
|  3 |    103 | Pawan Rajput    |      74 |        78 |    88 |   240 |    80.0000 |
|  4 |    104 | Raj Jaat        |      57 |        32 |    23 |   112 |    37.3333 |
|  5 |    105 | Raman Sharma    |      62 |        45 |    35 |   142 |    47.3333 |
|  6 |    106 | Khushali Rathod |      52 |        33 |    25 |   110 |    36.6667 |
|  7 |    107 | Anish Malwiya   |      63 |        75 |    52 |   190 |    63.3333 |
|  8 |    108 | Uday Dabi       |      25 |        63 |    42 |   130 |    43.3333 |
|  9 |    109 | Abhishek Yadav  |      65 |        47 |    63 |   175 |    58.3333 |
| 10 |    110 | bhvgf           |      54 |        87 |    54 |   195 |    65.0000 |
| 11 |    111 | Ravi Verma      |      35 |        22 |    18 |    75 |    25.0000 |
| 12 |    112 | Manoj Sharma    |      68 |        72 |    80 |   220 |    73.3333 |
| 13 |    113 | Aarti Gupta     |      44 |        48 |    39 |   131 |    43.6667 |
| 14 |    114 | Vishal Patel    |      59 |        67 |    45 |   171 |    57.0000 |
| 15 |    115 | Priya Mehta     |      82 |        88 |    91 |   261 |    87.0000 |
| 16 |    116 | Rajni Singh     |      49 |        35 |    26 |   110 |    36.6667 |
| 17 |    117 | Nidhi Chawla    |      60 |        55 |    53 |   168 |    56.0000 |
| 18 |    118 | Akshay Kumar    |      73 |        78 |    81 |   232 |    77.3333 |
| 19 |    119 | Neha Joshi      |      34 |        29 |    42 |   105 |    35.0000 |
| 20 |    120 | Kunal Mishra    |      58 |        65 |    60 |   183 |    61.0000 |
+----+--------+-----------------+---------+-----------+-------+-------+------------+
20 rows in set (0.00 sec)

mysql>

------------------------------------------------------------------------------------

Enter password: ****
Welcome to the MySQL monitor.  Commands end with ; or \g.
Your MySQL connection id is 1198
Server version: 8.0.29 MySQL Community Server - GPL

Copyright (c) 2000, 2022, Oracle and/or its affiliates.

Oracle is a registered trademark of Oracle Corporation and/or its
affiliates. Other names may be trademarks of their respective
owners.

Type 'help;' or '\h' for help. Type '\c' to clear the current input statement.

mysql> use vedik;
Database changed
mysql> select * from employee;
+----+--------+--------+---------------+
| id | name   | salary | company       |
+----+--------+--------+---------------+
|  1 | Ram    |  50000 | TCS           |
|  2 | Shyam  |  40000 | NCS           |
|  3 | Pawan  |  35000 | Mtech         |
|  4 | Amit   |  45000 | Infosys       |
|  5 | Suresh |  38000 | Wipro         |
|  6 | Priya  |  52000 | TCS           |
|  7 | Anjali |  47000 | HCL           |
|  8 | Ravi   |  43000 | Tech Mahindra |
|  9 | Kiran  |  39000 | Capgemini     |
| 10 | Meena  |  41000 | Accenture     |
| 11 | Vikram |  60000 | Infosys       |
| 12 | Pooja  |  44000 | HCL           |
| 13 | Raj    |  55000 | TCS           |
| 14 | Neha   |  47000 | Wipro         |
| 15 | Arjun  |  50000 | Tech Mahindra |
| 16 | Sunita |  48000 | Capgemini     |
| 17 | Deepak |  53000 | NCS           |
| 18 | Kavita |  46000 | Mtech         |
+----+--------+--------+---------------+
18 rows in set (0.00 sec)

mysql> show tables;
+-----------------+
| Tables_in_vedik |
+-----------------+
| employee        |
+-----------------+
1 row in set (0.01 sec)

mysql> create table department(id int primary key, deptName varchar(45));
Query OK, 0 rows affected (0.07 sec)

mysql> insert into department values(1, 'HR'),(2, 'Manager'),(3, 'Developer'),(4, 'Account');
Query OK, 4 rows affected (0.03 sec)
Records: 4  Duplicates: 0  Warnings: 0

mysql> select * from department;
+----+-----------+
| id | deptName  |
+----+-----------+
|  1 | HR        |
|  2 | Manager   |
|  3 | Developer |
|  4 | Account   |
+----+-----------+
4 rows in set (0.00 sec)

mysql> select * from employee;
+----+--------+--------+---------------+
| id | name   | salary | company       |
+----+--------+--------+---------------+
|  1 | Ram    |  50000 | TCS           |
|  2 | Shyam  |  40000 | NCS           |
|  3 | Pawan  |  35000 | Mtech         |
|  4 | Amit   |  45000 | Infosys       |
|  5 | Suresh |  38000 | Wipro         |
|  6 | Priya  |  52000 | TCS           |
|  7 | Anjali |  47000 | HCL           |
|  8 | Ravi   |  43000 | Tech Mahindra |
|  9 | Kiran  |  39000 | Capgemini     |
| 10 | Meena  |  41000 | Accenture     |
| 11 | Vikram |  60000 | Infosys       |
| 12 | Pooja  |  44000 | HCL           |
| 13 | Raj    |  55000 | TCS           |
| 14 | Neha   |  47000 | Wipro         |
| 15 | Arjun  |  50000 | Tech Mahindra |
| 16 | Sunita |  48000 | Capgemini     |
| 17 | Deepak |  53000 | NCS           |
| 18 | Kavita |  46000 | Mtech         |
+----+--------+--------+---------------+
18 rows in set (0.00 sec)

mysql> alter table employee dept_id int;
ERROR 1064 (42000): You have an error in your SQL syntax; check the manual that corresponds to your MySQL server version for the right syntax to use near 'dept_id int' at line 1
mysql> alter table employee add dept_id int;
Query OK, 0 rows affected (0.03 sec)
Records: 0  Duplicates: 0  Warnings: 0

mysql> select * from department;
+----+-----------+
| id | deptName  |
+----+-----------+
|  1 | HR        |
|  2 | Manager   |
|  3 | Developer |
|  4 | Account   |
+----+-----------+
4 rows in set (0.00 sec)

mysql> select * from employee;
+----+--------+--------+---------------+---------+
| id | name   | salary | company       | dept_id |
+----+--------+--------+---------------+---------+
|  1 | Ram    |  50000 | TCS           |    NULL |
|  2 | Shyam  |  40000 | NCS           |    NULL |
|  3 | Pawan  |  35000 | Mtech         |    NULL |
|  4 | Amit   |  45000 | Infosys       |    NULL |
|  5 | Suresh |  38000 | Wipro         |    NULL |
|  6 | Priya  |  52000 | TCS           |    NULL |
|  7 | Anjali |  47000 | HCL           |    NULL |
|  8 | Ravi   |  43000 | Tech Mahindra |    NULL |
|  9 | Kiran  |  39000 | Capgemini     |    NULL |
| 10 | Meena  |  41000 | Accenture     |    NULL |
| 11 | Vikram |  60000 | Infosys       |    NULL |
| 12 | Pooja  |  44000 | HCL           |    NULL |
| 13 | Raj    |  55000 | TCS           |    NULL |
| 14 | Neha   |  47000 | Wipro         |    NULL |
| 15 | Arjun  |  50000 | Tech Mahindra |    NULL |
| 16 | Sunita |  48000 | Capgemini     |    NULL |
| 17 | Deepak |  53000 | NCS           |    NULL |
| 18 | Kavita |  46000 | Mtech         |    NULL |
+----+--------+--------+---------------+---------+
18 rows in set (0.00 sec)

mysql> alter table employee add foreign key(dept_id) references department(id);
Query OK, 18 rows affected (0.07 sec)
Records: 18  Duplicates: 0  Warnings: 0

mysql> select * from department;
+----+-----------+
| id | deptName  |
+----+-----------+
|  1 | HR        |
|  2 | Manager   |
|  3 | Developer |
|  4 | Account   |
+----+-----------+
4 rows in set (0.00 sec)

mysql> select * from employee;
+----+--------+--------+---------------+---------+
| id | name   | salary | company       | dept_id |
+----+--------+--------+---------------+---------+
|  1 | Ram    |  50000 | TCS           |    NULL |
|  2 | Shyam  |  40000 | NCS           |    NULL |
|  3 | Pawan  |  35000 | Mtech         |    NULL |
|  4 | Amit   |  45000 | Infosys       |    NULL |
|  5 | Suresh |  38000 | Wipro         |    NULL |
|  6 | Priya  |  52000 | TCS           |    NULL |
|  7 | Anjali |  47000 | HCL           |    NULL |
|  8 | Ravi   |  43000 | Tech Mahindra |    NULL |
|  9 | Kiran  |  39000 | Capgemini     |    NULL |
| 10 | Meena  |  41000 | Accenture     |    NULL |
| 11 | Vikram |  60000 | Infosys       |    NULL |
| 12 | Pooja  |  44000 | HCL           |    NULL |
| 13 | Raj    |  55000 | TCS           |    NULL |
| 14 | Neha   |  47000 | Wipro         |    NULL |
| 15 | Arjun  |  50000 | Tech Mahindra |    NULL |
| 16 | Sunita |  48000 | Capgemini     |    NULL |
| 17 | Deepak |  53000 | NCS           |    NULL |
| 18 | Kavita |  46000 | Mtech         |    NULL |
+----+--------+--------+---------------+---------+
18 rows in set (0.00 sec)

mysql> update employee set dept_id = 2 where id = 1;
Query OK, 1 row affected (0.01 sec)
Rows matched: 1  Changed: 1  Warnings: 0

mysql> select * from employee;
+----+--------+--------+---------------+---------+
| id | name   | salary | company       | dept_id |
+----+--------+--------+---------------+---------+
|  1 | Ram    |  50000 | TCS           |       2 |
|  2 | Shyam  |  40000 | NCS           |    NULL |
|  3 | Pawan  |  35000 | Mtech         |    NULL |
|  4 | Amit   |  45000 | Infosys       |    NULL |
|  5 | Suresh |  38000 | Wipro         |    NULL |
|  6 | Priya  |  52000 | TCS           |    NULL |
|  7 | Anjali |  47000 | HCL           |    NULL |
|  8 | Ravi   |  43000 | Tech Mahindra |    NULL |
|  9 | Kiran  |  39000 | Capgemini     |    NULL |
| 10 | Meena  |  41000 | Accenture     |    NULL |
| 11 | Vikram |  60000 | Infosys       |    NULL |
| 12 | Pooja  |  44000 | HCL           |    NULL |
| 13 | Raj    |  55000 | TCS           |    NULL |
| 14 | Neha   |  47000 | Wipro         |    NULL |
| 15 | Arjun  |  50000 | Tech Mahindra |    NULL |
| 16 | Sunita |  48000 | Capgemini     |    NULL |
| 17 | Deepak |  53000 | NCS           |    NULL |
| 18 | Kavita |  46000 | Mtech         |    NULL |
+----+--------+--------+---------------+---------+
18 rows in set (0.00 sec)

mysql> select * from department;
+----+-----------+
| id | deptName  |
+----+-----------+
|  1 | HR        |
|  2 | Manager   |
|  3 | Developer |
|  4 | Account   |
+----+-----------+
4 rows in set (0.00 sec)

mysql> update employee set dept_id = 6 where id = 3;
ERROR 1452 (23000): Cannot add or update a child row: a foreign key constraint fails (`vedik`.`employee`, CONSTRAINT `employee_ibfk_1` FOREIGN KEY (`dept_id`) REFERENCES `department` (`id`))
mysql> update employee set dept_id = 3 where id = 6;
Query OK, 1 row affected (0.00 sec)
Rows matched: 1  Changed: 1  Warnings: 0

mysql> select * from department;
+----+-----------+
| id | deptName  |
+----+-----------+
|  1 | HR        |
|  2 | Manager   |
|  3 | Developer |
|  4 | Account   |
+----+-----------+
4 rows in set (0.00 sec)

mysql> select * from employee;
+----+--------+--------+---------------+---------+
| id | name   | salary | company       | dept_id |
+----+--------+--------+---------------+---------+
|  1 | Ram    |  50000 | TCS           |       2 |
|  2 | Shyam  |  40000 | NCS           |    NULL |
|  3 | Pawan  |  35000 | Mtech         |    NULL |
|  4 | Amit   |  45000 | Infosys       |    NULL |
|  5 | Suresh |  38000 | Wipro         |    NULL |
|  6 | Priya  |  52000 | TCS           |       3 |
|  7 | Anjali |  47000 | HCL           |    NULL |
|  8 | Ravi   |  43000 | Tech Mahindra |    NULL |
|  9 | Kiran  |  39000 | Capgemini     |    NULL |
| 10 | Meena  |  41000 | Accenture     |    NULL |
| 11 | Vikram |  60000 | Infosys       |    NULL |
| 12 | Pooja  |  44000 | HCL           |    NULL |
| 13 | Raj    |  55000 | TCS           |    NULL |
| 14 | Neha   |  47000 | Wipro         |    NULL |
| 15 | Arjun  |  50000 | Tech Mahindra |    NULL |
| 16 | Sunita |  48000 | Capgemini     |    NULL |
| 17 | Deepak |  53000 | NCS           |    NULL |
| 18 | Kavita |  46000 | Mtech         |    NULL |
+----+--------+--------+---------------+---------+
18 rows in set (0.00 sec)

mysql> update employee set dept_id = 1 where id = 8;
Query OK, 1 row affected (0.01 sec)
Rows matched: 1  Changed: 1  Warnings: 0

mysql> select * from employee;
+----+--------+--------+---------------+---------+
| id | name   | salary | company       | dept_id |
+----+--------+--------+---------------+---------+
|  1 | Ram    |  50000 | TCS           |       2 |
|  2 | Shyam  |  40000 | NCS           |    NULL |
|  3 | Pawan  |  35000 | Mtech         |    NULL |
|  4 | Amit   |  45000 | Infosys       |    NULL |
|  5 | Suresh |  38000 | Wipro         |    NULL |
|  6 | Priya  |  52000 | TCS           |       3 |
|  7 | Anjali |  47000 | HCL           |    NULL |
|  8 | Ravi   |  43000 | Tech Mahindra |       1 |
|  9 | Kiran  |  39000 | Capgemini     |    NULL |
| 10 | Meena  |  41000 | Accenture     |    NULL |
| 11 | Vikram |  60000 | Infosys       |    NULL |
| 12 | Pooja  |  44000 | HCL           |    NULL |
| 13 | Raj    |  55000 | TCS           |    NULL |
| 14 | Neha   |  47000 | Wipro         |    NULL |
| 15 | Arjun  |  50000 | Tech Mahindra |    NULL |
| 16 | Sunita |  48000 | Capgemini     |    NULL |
| 17 | Deepak |  53000 | NCS           |    NULL |
| 18 | Kavita |  46000 | Mtech         |    NULL |
+----+--------+--------+---------------+---------+
18 rows in set (0.00 sec)

mysql> select * from department;
+----+-----------+
| id | deptName  |
+----+-----------+
|  1 | HR        |
|  2 | Manager   |
|  3 | Developer |
|  4 | Account   |
+----+-----------+
4 rows in set (0.00 sec)

mysql>

-------------------------------------------------------------------------

Enter password: ****
Welcome to the MySQL monitor.  Commands end with ; or \g.
Your MySQL connection id is 1931
Server version: 8.0.29 MySQL Community Server - GPL

Copyright (c) 2000, 2022, Oracle and/or its affiliates.

Oracle is a registered trademark of Oracle Corporation and/or its
affiliates. Other names may be trademarks of their respective
owners.

Type 'help;' or '\h' for help. Type '\c' to clear the current input statement.

mysql> use vedik;
Database changed
mysql> select * from employee;
+----+--------+--------+---------------+---------+
| id | name   | salary | company       | dept_id |
+----+--------+--------+---------------+---------+
|  1 | Ram    |  50000 | TCS           |       2 |
|  2 | Shyam  |  40000 | NCS           |    NULL |
|  3 | Pawan  |  35000 | Mtech         |    NULL |
|  4 | Amit   |  45000 | Infosys       |    NULL |
|  5 | Suresh |  38000 | Wipro         |    NULL |
|  6 | Priya  |  52000 | TCS           |       3 |
|  7 | Anjali |  47000 | HCL           |    NULL |
|  8 | Ravi   |  43000 | Tech Mahindra |       1 |
|  9 | Kiran  |  39000 | Capgemini     |    NULL |
| 10 | Meena  |  41000 | Accenture     |    NULL |
| 11 | Vikram |  60000 | Infosys       |    NULL |
| 12 | Pooja  |  44000 | HCL           |    NULL |
| 13 | Raj    |  55000 | TCS           |    NULL |
| 14 | Neha   |  47000 | Wipro         |    NULL |
| 15 | Arjun  |  50000 | Tech Mahindra |    NULL |
| 16 | Sunita |  48000 | Capgemini     |    NULL |
| 17 | Deepak |  53000 | NCS           |    NULL |
| 18 | Kavita |  46000 | Mtech         |    NULL |
+----+--------+--------+---------------+---------+
18 rows in set (0.01 sec)

mysql> select * from department;
+----+-----------+
| id | deptName  |
+----+-----------+
|  1 | HR        |
|  2 | Manager   |
|  3 | Developer |
|  4 | Account   |
+----+-----------+
4 rows in set (0.00 sec)

mysql> select * from employee left join department on department.id = employee.deptId;
ERROR 1054 (42S22): Unknown column 'employee.deptId' in 'on clause'
mysql> select * from employee left join department on department.id = employee.dept_Id;
+----+--------+--------+---------------+---------+------+-----------+
| id | name   | salary | company       | dept_id | id   | deptName  |
+----+--------+--------+---------------+---------+------+-----------+
|  1 | Ram    |  50000 | TCS           |       2 |    2 | Manager   |
|  2 | Shyam  |  40000 | NCS           |    NULL | NULL | NULL      |
|  3 | Pawan  |  35000 | Mtech         |    NULL | NULL | NULL      |
|  4 | Amit   |  45000 | Infosys       |    NULL | NULL | NULL      |
|  5 | Suresh |  38000 | Wipro         |    NULL | NULL | NULL      |
|  6 | Priya  |  52000 | TCS           |       3 |    3 | Developer |
|  7 | Anjali |  47000 | HCL           |    NULL | NULL | NULL      |
|  8 | Ravi   |  43000 | Tech Mahindra |       1 |    1 | HR        |
|  9 | Kiran  |  39000 | Capgemini     |    NULL | NULL | NULL      |
| 10 | Meena  |  41000 | Accenture     |    NULL | NULL | NULL      |
| 11 | Vikram |  60000 | Infosys       |    NULL | NULL | NULL      |
| 12 | Pooja  |  44000 | HCL           |    NULL | NULL | NULL      |
| 13 | Raj    |  55000 | TCS           |    NULL | NULL | NULL      |
| 14 | Neha   |  47000 | Wipro         |    NULL | NULL | NULL      |
| 15 | Arjun  |  50000 | Tech Mahindra |    NULL | NULL | NULL      |
| 16 | Sunita |  48000 | Capgemini     |    NULL | NULL | NULL      |
| 17 | Deepak |  53000 | NCS           |    NULL | NULL | NULL      |
| 18 | Kavita |  46000 | Mtech         |    NULL | NULL | NULL      |
+----+--------+--------+---------------+---------+------+-----------+
18 rows in set (0.01 sec)

mysql> select * from employee right join department on department.id = employee.dept_Id;
+------+-------+--------+---------------+---------+----+-----------+
| id   | name  | salary | company       | dept_id | id | deptName  |
+------+-------+--------+---------------+---------+----+-----------+
|    8 | Ravi  |  43000 | Tech Mahindra |       1 |  1 | HR        |
|    1 | Ram   |  50000 | TCS           |       2 |  2 | Manager   |
|    6 | Priya |  52000 | TCS           |       3 |  3 | Developer |
| NULL | NULL  |   NULL | NULL          |    NULL |  4 | Account   |
+------+-------+--------+---------------+---------+----+-----------+
4 rows in set (0.00 sec)

mysql> select * from employee inner join department on department.id = employee.dept_Id;
+----+-------+--------+---------------+---------+----+-----------+
| id | name  | salary | company       | dept_id | id | deptName  |
+----+-------+--------+---------------+---------+----+-----------+
|  8 | Ravi  |  43000 | Tech Mahindra |       1 |  1 | HR        |
|  1 | Ram   |  50000 | TCS           |       2 |  2 | Manager   |
|  6 | Priya |  52000 | TCS           |       3 |  3 | Developer |
+----+-------+--------+---------------+---------+----+-----------+
3 rows in set (0.00 sec)

mysql> select * from department left join employee on employee.dept_id = department.id;
+----+-----------+------+-------+--------+---------------+---------+
| id | deptName  | id   | name  | salary | company       | dept_id |
+----+-----------+------+-------+--------+---------------+---------+
|  1 | HR        |    8 | Ravi  |  43000 | Tech Mahindra |       1 |
|  2 | Manager   |    1 | Ram   |  50000 | TCS           |       2 |
|  3 | Developer |    6 | Priya |  52000 | TCS           |       3 |
|  4 | Account   | NULL | NULL  |   NULL | NULL          |    NULL |
+----+-----------+------+-------+--------+---------------+---------+
4 rows in set (0.00 sec)

mysql> select * from department right join employee on employee.dept_id = department.id;
+------+-----------+----+--------+--------+---------------+---------+
| id   | deptName  | id | name   | salary | company       | dept_id |
+------+-----------+----+--------+--------+---------------+---------+
|    2 | Manager   |  1 | Ram    |  50000 | TCS           |       2 |
| NULL | NULL      |  2 | Shyam  |  40000 | NCS           |    NULL |
| NULL | NULL      |  3 | Pawan  |  35000 | Mtech         |    NULL |
| NULL | NULL      |  4 | Amit   |  45000 | Infosys       |    NULL |
| NULL | NULL      |  5 | Suresh |  38000 | Wipro         |    NULL |
|    3 | Developer |  6 | Priya  |  52000 | TCS           |       3 |
| NULL | NULL      |  7 | Anjali |  47000 | HCL           |    NULL |
|    1 | HR        |  8 | Ravi   |  43000 | Tech Mahindra |       1 |
| NULL | NULL      |  9 | Kiran  |  39000 | Capgemini     |    NULL |
| NULL | NULL      | 10 | Meena  |  41000 | Accenture     |    NULL |
| NULL | NULL      | 11 | Vikram |  60000 | Infosys       |    NULL |
| NULL | NULL      | 12 | Pooja  |  44000 | HCL           |    NULL |
| NULL | NULL      | 13 | Raj    |  55000 | TCS           |    NULL |
| NULL | NULL      | 14 | Neha   |  47000 | Wipro         |    NULL |
| NULL | NULL      | 15 | Arjun  |  50000 | Tech Mahindra |    NULL |
| NULL | NULL      | 16 | Sunita |  48000 | Capgemini     |    NULL |
| NULL | NULL      | 17 | Deepak |  53000 | NCS           |    NULL |
| NULL | NULL      | 18 | Kavita |  46000 | Mtech         |    NULL |
+------+-----------+----+--------+--------+---------------+---------+
18 rows in set (0.00 sec)

mysql> select * from department inner join employee on employee.dept_id = department.id;
+----+-----------+----+-------+--------+---------------+---------+
| id | deptName  | id | name  | salary | company       | dept_id |
+----+-----------+----+-------+--------+---------------+---------+
|  1 | HR        |  8 | Ravi  |  43000 | Tech Mahindra |       1 |
|  2 | Manager   |  1 | Ram   |  50000 | TCS           |       2 |
|  3 | Developer |  6 | Priya |  52000 | TCS           |       3 |
+----+-----------+----+-------+--------+---------------+---------+
3 rows in set (0.00 sec)

mysql> select * from employee left join department on department.id = employee.dept_Id union select * from employee right join department on department.id = employee.dept_Id;
+------+--------+--------+---------------+---------+------+-----------+
| id   | name   | salary | company       | dept_id | id   | deptName  |
+------+--------+--------+---------------+---------+------+-----------+
|    1 | Ram    |  50000 | TCS           |       2 |    2 | Manager   |
|    2 | Shyam  |  40000 | NCS           |    NULL | NULL | NULL      |
|    3 | Pawan  |  35000 | Mtech         |    NULL | NULL | NULL      |
|    4 | Amit   |  45000 | Infosys       |    NULL | NULL | NULL      |
|    5 | Suresh |  38000 | Wipro         |    NULL | NULL | NULL      |
|    6 | Priya  |  52000 | TCS           |       3 |    3 | Developer |
|    7 | Anjali |  47000 | HCL           |    NULL | NULL | NULL      |
|    8 | Ravi   |  43000 | Tech Mahindra |       1 |    1 | HR        |
|    9 | Kiran  |  39000 | Capgemini     |    NULL | NULL | NULL      |
|   10 | Meena  |  41000 | Accenture     |    NULL | NULL | NULL      |
|   11 | Vikram |  60000 | Infosys       |    NULL | NULL | NULL      |
|   12 | Pooja  |  44000 | HCL           |    NULL | NULL | NULL      |
|   13 | Raj    |  55000 | TCS           |    NULL | NULL | NULL      |
|   14 | Neha   |  47000 | Wipro         |    NULL | NULL | NULL      |
|   15 | Arjun  |  50000 | Tech Mahindra |    NULL | NULL | NULL      |
|   16 | Sunita |  48000 | Capgemini     |    NULL | NULL | NULL      |
|   17 | Deepak |  53000 | NCS           |    NULL | NULL | NULL      |
|   18 | Kavita |  46000 | Mtech         |    NULL | NULL | NULL      |
| NULL | NULL   |   NULL | NULL          |    NULL |    4 | Account   |
+------+--------+--------+---------------+---------+------+-----------+
19 rows in set (0.03 sec)

mysql> select * from employee left join department on department.id = employee.dept_Id where employee.id is null union select * from employee right join department on department.id = employee.dept_Id where department.dept_id is null;
ERROR 1054 (42S22): Unknown column 'department.dept_id' in 'where clause'
mysql> select * from employee left join department on department.id = employee.dept_Id where employee.id is null union select * from employee right join department on department.id = employee.dept_Id where department.id is null;
Empty set (0.00 sec)

mysql> select * from employee left join department on department.id = employee.dept_Id where department.id is null union select * from employee right join department on department.id = employee.dept_Id where employee.dept_id is null;
+------+--------+--------+---------------+---------+------+----------+
| id   | name   | salary | company       | dept_id | id   | deptName |
+------+--------+--------+---------------+---------+------+----------+
|    2 | Shyam  |  40000 | NCS           |    NULL | NULL | NULL     |
|    3 | Pawan  |  35000 | Mtech         |    NULL | NULL | NULL     |
|    4 | Amit   |  45000 | Infosys       |    NULL | NULL | NULL     |
|    5 | Suresh |  38000 | Wipro         |    NULL | NULL | NULL     |
|    7 | Anjali |  47000 | HCL           |    NULL | NULL | NULL     |
|    9 | Kiran  |  39000 | Capgemini     |    NULL | NULL | NULL     |
|   10 | Meena  |  41000 | Accenture     |    NULL | NULL | NULL     |
|   11 | Vikram |  60000 | Infosys       |    NULL | NULL | NULL     |
|   12 | Pooja  |  44000 | HCL           |    NULL | NULL | NULL     |
|   13 | Raj    |  55000 | TCS           |    NULL | NULL | NULL     |
|   14 | Neha   |  47000 | Wipro         |    NULL | NULL | NULL     |
|   15 | Arjun  |  50000 | Tech Mahindra |    NULL | NULL | NULL     |
|   16 | Sunita |  48000 | Capgemini     |    NULL | NULL | NULL     |
|   17 | Deepak |  53000 | NCS           |    NULL | NULL | NULL     |
|   18 | Kavita |  46000 | Mtech         |    NULL | NULL | NULL     |
| NULL | NULL   |   NULL | NULL          |    NULL |    4 | Account  |
+------+--------+--------+---------------+---------+------+----------+
16 rows in set (0.01 sec)

mysql> select salary from employee left join department on department.id = employee.dept_Id where department.id is null union select * from employee right join department on department.id = employee.dept_Id where employee.dept_id is null;
ERROR 1222 (21000): The used SELECT statements have a different number of columns
mysql> select employee.salary, department.deptName from employee left join department on department.id = employee.dept_Id where department.id is null union select * from employee right join department on department.id = employee.dept_Id where employee.dept_id is null;
ERROR 1222 (21000): The used SELECT statements have a different number of columns
mysql> select * from employee left join department on department.id = employee.dept_Id where department.id is null union select * from employee right join department on department.id = employee.dept_Id where employee.dept_id is null;
+------+--------+--------+---------------+---------+------+----------+
| id   | name   | salary | company       | dept_id | id   | deptName |
+------+--------+--------+---------------+---------+------+----------+
|    2 | Shyam  |  40000 | NCS           |    NULL | NULL | NULL     |
|    3 | Pawan  |  35000 | Mtech         |    NULL | NULL | NULL     |
|    4 | Amit   |  45000 | Infosys       |    NULL | NULL | NULL     |
|    5 | Suresh |  38000 | Wipro         |    NULL | NULL | NULL     |
|    7 | Anjali |  47000 | HCL           |    NULL | NULL | NULL     |
|    9 | Kiran  |  39000 | Capgemini     |    NULL | NULL | NULL     |
|   10 | Meena  |  41000 | Accenture     |    NULL | NULL | NULL     |
|   11 | Vikram |  60000 | Infosys       |    NULL | NULL | NULL     |
|   12 | Pooja  |  44000 | HCL           |    NULL | NULL | NULL     |
|   13 | Raj    |  55000 | TCS           |    NULL | NULL | NULL     |
|   14 | Neha   |  47000 | Wipro         |    NULL | NULL | NULL     |
|   15 | Arjun  |  50000 | Tech Mahindra |    NULL | NULL | NULL     |
|   16 | Sunita |  48000 | Capgemini     |    NULL | NULL | NULL     |
|   17 | Deepak |  53000 | NCS           |    NULL | NULL | NULL     |
|   18 | Kavita |  46000 | Mtech         |    NULL | NULL | NULL     |
| NULL | NULL   |   NULL | NULL          |    NULL |    4 | Account  |
+------+--------+--------+---------------+---------+------+----------+
16 rows in set (0.00 sec)

mysql> select salary from employee left join department on department.id = employee.dept_Id where department.id is null union select salary from employee right join department on department.id = employee.dept_Id where employee.dept_id is null;
+--------+
| salary |
+--------+
|  40000 |
|  35000 |
|  45000 |
|  38000 |
|  47000 |
|  39000 |
|  41000 |
|  60000 |
|  44000 |
|  55000 |
|  50000 |
|  48000 |
|  53000 |
|  46000 |
|   NULL |
+--------+
15 rows in set (0.00 sec)

mysql> select salary, name, deptName from employee left join department on department.id = employee.dept_Id where department.id is null union select salary, name, deptName from employee right join department on department.id = employee.dept_Id where employee.dept_id is null;
+--------+--------+----------+
| salary | name   | deptName |
+--------+--------+----------+
|  40000 | Shyam  | NULL     |
|  35000 | Pawan  | NULL     |
|  45000 | Amit   | NULL     |
|  38000 | Suresh | NULL     |
|  47000 | Anjali | NULL     |
|  39000 | Kiran  | NULL     |
|  41000 | Meena  | NULL     |
|  60000 | Vikram | NULL     |
|  44000 | Pooja  | NULL     |
|  55000 | Raj    | NULL     |
|  47000 | Neha   | NULL     |
|  50000 | Arjun  | NULL     |
|  48000 | Sunita | NULL     |
|  53000 | Deepak | NULL     |
|  46000 | Kavita | NULL     |
|   NULL | NULL   | Account  |
+--------+--------+----------+
16 rows in set (0.00 sec)

mysql> select salary, name, deptName from employee left join department on department.id = employee.dept_Id union select salary, name, deptName from employee right join department on department.id = employee.dept_Id;
+--------+--------+-----------+
| salary | name   | deptName  |
+--------+--------+-----------+
|  50000 | Ram    | Manager   |
|  40000 | Shyam  | NULL      |
|  35000 | Pawan  | NULL      |
|  45000 | Amit   | NULL      |
|  38000 | Suresh | NULL      |
|  52000 | Priya  | Developer |
|  47000 | Anjali | NULL      |
|  43000 | Ravi   | HR        |
|  39000 | Kiran  | NULL      |
|  41000 | Meena  | NULL      |
|  60000 | Vikram | NULL      |
|  44000 | Pooja  | NULL      |
|  55000 | Raj    | NULL      |
|  47000 | Neha   | NULL      |
|  50000 | Arjun  | NULL      |
|  48000 | Sunita | NULL      |
|  53000 | Deepak | NULL      |
|  46000 | Kavita | NULL      |
|   NULL | NULL   | Account   |
+--------+--------+-----------+
19 rows in set (0.00 sec)

mysql> select name, company, salary, deptName from department inner join employee on employee.dept_id = department.id;
+-------+---------------+--------+-----------+
| name  | company       | salary | deptName  |
+-------+---------------+--------+-----------+
| Ravi  | Tech Mahindra |  43000 | HR        |
| Ram   | TCS           |  50000 | Manager   |
| Priya | TCS           |  52000 | Developer |
+-------+---------------+--------+-----------+
3 rows in set (0.00 sec)

mysql>